title,body
سعودي في الجول,"وافق 47 ناد سعودي على مشروع توثيق تاريخ الكرة السعودية، فيما أبدى نادي الشباب اعتراضه.
وغادر ممثل نادي الشباب الاجتماع الأخير لمشروع توثيق تاريخ الكرة السعودية وذلك قبل إصدار التقرير النهائي بنتائج المشروع.
وبحسب صحيفة الشرق الأوسط السعودية، فإن فارس العلياني ممثل نادي الشباب رفع البطاقة الحمراء اعتراضا على المصادقة على التقرير النهائي المتعلق بنتائج المشروع.
وقال العلياني عبر وسال إعلام سعودية: ""أحسن الله عزاءنا في تاريخنا الرياضي، ما حدث هو عبث، والمتضرر الوحيد في هذا المشروع هو نادي الشباب"".
وأضاف""نحن كُنا رابع الترتيب في سجل أبطال الدوري ثم أصبحنا خامسا. اتحاد القدم رمى موضوع التوثيق لدى الجمعية العمومية، ومع الأسف أندية ليس لها تاريخ رياضي تصوت وتقرر"".
وستقوم الأندية بإعلان عدد بطولاتها وفقا لنتائج التقرير بعد المصادقة على التقرير النهائي لمشروع توثيق تاريخ كرة القدم السعودية، ، بعد ذلك سيتم الإعلان عنها في موقع الاتحاد السعودي لكرة القدم.
وأشارت التقارير إلى أن فريق عمل مشروع توثيق تاريخ كرة القدم السعودية بين في تقريره أن عدد البطولات المرصودة 3910 بطولة، وعدد الأبطال 155 نادي.
وأضاف أن عدد البطولات المرصودة للفريق الأول 1282 بطولة، وللفئات العمرية 2628 بطولة.
وأوضحت التقارير أن عدد الأندية المصادقة على نتائج مشروع توثيق تاريخ كرة القدم السعودية 47 ناد، الشباب هو النادي الوحيد الذي رفض المصادقة."
الدوري المصري,"تلقى الأهلي عرضا رسميا من نادي فالنسيا الإسباني للتعاقد مع حارس مرماه مصطفى شوبير في الموسم المقبل.
وعلمFilGoal.comأن الأهلي تلقى عرضا رسميا من النادي الإسباني طلب خلاله التعاقد مع مصطفى شوبير.
لكن إدارة الأهلي أجلت الرد على هذا العرض لحين الانتهاء من فترة ضغط المباريات الحالية.
وأن إدارة النادي ومحمد رمضان المدير الرياضي أسندا هذا الملف لـ محمد شوقي نائب المدير الرياضي للتفاوض مع الطرف الإسباني.
ولكن ليس في الوقت الحالي بسبب انشغال الفريق بالاستعداد لمباراة صنداونز وما تبقى من مباريات في الموسم الحالي.
وتم تصعيد مصطفى شوبير البالغ من العمر 24 عاما للفريق الأول للأهلي في موسم 2019/2020 وخاض أول مباراة له تحت قيادة المدرب السويسري الأسبق رينيه فايلر.
وفي الموسم الجاري لعب مصطفى شوبير 8 مباريات مع الأهلي بواقع 6 في الدوري المصري، ومباراة في دوري أبطال إفريقيا وأخرى في السوبر المصري.
وتألق مصطفى شوبير مع الأهلي في الموسم الماضي بعد إصابة محمد الشناوي وقاد الفريق للتتويج بدوري أبطال إفريقيا دون أن يتلقى أي أهداف.
وذلك بعدما لعب 9 مباريات حافظ فيها جميعا على نظافة شباكه.
كما ينضم مصطفى شوبير بشكل مستمر لمنتخب مصر منذ تولي حسام حسن تدريب الفراعنة وشارك معه في مباراة واحدة."
الكرة الأوروبية,"عبر أوريلين تشواميني لاعب ريال مدريد عن سعادته بحصوله على جائزة لاعب الشهر في الفريق، وعلى الجانب الآخر شدد أن الملكي سيواصل المنافسة على الدوري.
ويستعد ريال مدريد لمواجهة خيتافي غدا الأربعاء بالجولة 33 من الدوري الإسباني على ملعب كوليسيوم.
وقال اللاعب الفرنسي لموقع ناديه: ""سعيد للغاية بالحصول على جائزة لاعب الشهر في الفريق، هذا الشيء يعني لي الكثير، أسعى كل يوم لأحسن أدائي سواء بالكرة أو دونها"".
وأضاف ""هدفي مساعدة زملائي في الفريق قدر الإمكان وتحقيق الفوز في المباريات"".
وتابع ""مباراة خيتافي مهمة، نحن في المرحلة الأخيرة من الموسم، ولذلك تصبح المباريات أكثر أهمية"".
وأنهى حديثه قائلا: ""علينا الالتزام وبذل أقصى مجهود ممكن للفوز ومواصلة المنافسة على الدوري الإسباني"".
ويحتل ريال مدريد المركز الثاني في جدول ترتيب الدوري الإسباني برصيد 69 نقطة."
ميركاتو,"يسعى نادي الهلال لتعويض رحيل البرازيلي نيمار عن الفريق بضم نجم بارز.
وكان قد ارتبط اسم فينيسيوس جونيور بالانتقال إلى الهلال لكن تشير التقارير إلى أن اللاعب قرر عدم الرحيل عن ريال مدريد في المستقبل القريب.
وكشفت صحيفة سبورت الإسبانية أن الهلال يدرس خيارات لتعزيز هجومه بجناح من الطراز الرفيع.
وأوضح التقرير أن إدارة الهلال مهتمة بضم البرازيلي رافينيا نجم فريق برشلونة.
ونجح رافينيا في تسجيل 30 هدفا وصناعة 22 آخرين خلال 48 خاضهم برشلونة هذا الموسم.
ويعتبر رافينيا أحد أبرز اللاعبين المرشحين للتتويج بجائزة الكرة الذهبية في 2025.
وكشف التقرير عن اهتمام أندية مثل الهلال والنصر واتحاد جدة لضم نجوم من فريق برشلونة.
وأبرز الأسماء المرشحة من برشلونة للانتقال إلى الدوري السعودي فرينكي دي يونج ورونالد أراخو.
ويحتل برشلونة صدارة ترتيب الدوري الإسباني قبل ست جولات من النهاية بفارق 4 نقاط عن ريال مدريد."
كرة يد,"كشف ماركوس ماركيز مدرب حراس مرمى الزمالك لكرة اليد عن رحيله إلى كرواتيا.
ولم ينته موسم الزمالك في كرة اليد إذ يتبقى المنافسة على بطولتي السوبر الإفريقي وكأس الكؤوس الإفريقية.
وكشف ماركوس ماركيز مدرب حراس مرمى الزمالك لكرة اليد عبر حسابه الشخصي ""مشجع أهلاوي ساعدني أنا وعائلتي للوصول بسلام إلى كرواتيا"".
وتابع ""أشكره على ذلك وعندما أتأكد أن عائلتي في أمان سأتحدث عن طل شيء بخصوص الزمالك"".
وكان ماركوس قد انضم إلى الجهاز الفني بقيادة الإسباني فرناندو باربيتو المدير الفني للفريق.
ولم يكشف ماركوس تفاصيل رحيله عن مصر إلى كرواتيا موضحا حديثه في وقت لاحق.
وخسر الزمالك هذا الموسم لقب بطولتي الدوري وكأس مصر أمام الأهلي."
كرة يد,"حسم فريق سيدات الأهلي لكرة اليد لقب الدوري المصري للمرة الثالثة على التوالي قبل جولة من ختام المسابقة.
وتغلب الأهلي على الشمس بنتيجة 30-18 في المباراة التي أقيمت على صالة حسن مصطفى قبل جولة من ختام الدورة المجمعة الثانية.
وحققت سيدات الأهلي بذلك لقب الدوري للمرة الخامسة والأربعين في التاريخ.
ويختتم فريق الأهلي منافساته بمواجهة الزمالك غدا الأربعاء في مباراة تحصيل حصل.
ورفع الأهلي رصيده إلى 19 نقطة بفارق 8 نقاط عن الشمس أقرب منافسيه.
أما الزمالك فيتذيل الترتيب برصيد 3 نقاط قبل المباراة الختامية.
ويستعد فريق الأهلي لخوض منافساتي السوبر الإفريقي وكأس الكؤوس لسيدات كرة اليد.
ويستضيف الأهلي منافسات البطولتين على صالته في مايو المقبل."
الكرة المصرية,"أشاد رولاني موكوينا المدير الفني لـ الوداد الغربي بنظيره الأهلي قبل انطلاق منافسات كأس العالم للأندية 2025.
ويستعد الوداد لخوض منافسات كأس العالم للأندية المقرر لها في الولايات المتحدة الأمريكية خلال الفترة من 15 يونيو إلى 14 يوليو المقبلين.
وقال المدرب الجنوب إفريقي لصحيفة توتو سبورت: ""أشعر ببعض الحسد تجاه الأهلي؟ هذه الكلمة قوية نوعا ما، هناك احترام وإعجاب بما حققه الأهلي ونجاحه مثير للإعجاب، لا شك في ذلك"".
وأتم ""الأهلي مرجع لجميع الأندية الإفريقية، هذا دليل على أنه من الممكن بالاستقرار والعمل الجاد التطلع إلى مستويات مماثلة"".
ويقع الوداد المغربي في مجموعة نارية رفقة أندية يوفنتوس ومانشستر سيتي والعين الإماراتي.
ويستهل الوداد مشواره بمواجهة مانشستر سيتي يوم 18 يونيو قبل أن يواجه يوفنتوس ثم مانشستر سيتي."
الدوري المصري,"عقد البرتغالي جوزيه بيسيرو المدير الفني للفريق الأول لكرة القدم بنادي الزمالك جلسة مع اللاعبين قبل انطلاق مران اليوم الثلاثاء على ملعب النادي، استعداداً لمباراة المصري المقبلة في مسابقة الدوري الممتاز.
شهدت الجلسة حضور جميع الجهاز الفني بالكامل، وأكد المدير الفني البرتغالي على أهمية المرحلة المقبلة في ظل ارتباط الفريق بمباريات قوية في مسابقة الدوري، بجانب نهائي كأس مصر أمام فريق بيراميدز.
ومنح جوزيه بيسيرو تعليماته الفنية للاعبين من أجل تنفيذها خلال مران اليوم استعداداً لمباراة المصري المرتقبة.
و شهدت تدريبات الفريق تصعيد عمر محمد صلاح حارس مرمى فريق 2007 بقطاع الناشئين.
وأدى عمر محمد التدريبات برفقة حراس المرمى تحت قيادة نونو ميجيل مدرب حراس الفريق الأول.
وخاض الفريق تقسيمة فنية مطولة وأدى الفريق فقرة فنية وخططية ركز خلالها الجهاز الفني بقيادة البرتغالي جوزيه بيسيرو على تدريب اللاعبين على الكرات الثابتة.
وخصص الجهاز الفني فقرة كاملة بعد التقسيمة للعمل على إنهاء الهجمات بالشكل الأمثل، استعداداً للمباريات المقبلة.
وقرر الجهاز الفني للفريق الأول لكرة القدم بنادي الزمالك بقيادة البرتغالي جوزيه بيسيرو، الانتظام في معسكر مغلق يوم الاثنين المقبل، الموافق 28 إبريل الجاري في مدينة برج العرب بالإسكندرية، في إطار الاستعداد لمباراة المصري المقبلة في مسابقة الدوري الممتاز.
ويستعد فريق الزمالك لمواجهة المصري، المقرر لها يوم 1 مايو المقبل على ستاد الجيش ببرج العرب، في الجولة الثالثة للمرحلة النهائية لمسابقة الدوري المصري الممتاز.
ويحتل الزمالك المركز الثالث بجدول ترتيب الدوري المصري برصيد 38 نقطة بفارق 6 نقاط عن بيراميدز المتصدر ونقطتين عن الأهلي صاحب المركز الثاني."
