title,body
الكرة المصرية,"كتب :عبد الرحمن فوزي| الإثنين، 16 سبتمبر 2024 - 21:23
ثروت سويلم، رجل نجح مهنيا، وتمكن من الوصول لأعلى المناصب، بداية من عمله في الشرطة والوصول لرتبة اللواء ودخوله مجال كرة القدم عن طريق الاتحاد المصري لكرة القدم لسنوات عديدة وأخيرا الانضمام لرابطة الأندية المصرية.
بالإضافة إلى ما سبق، فإن سويلم هو عضو بمجلس النواب المصري ما يعني بلوغه قمة الهرم سياسيا ورياضيا.
لو لم يكن سويلم ناجح مهنيا، لما وصل إلى تلك المناصب ولا بد أنه يملك مهارات كثيرة، بالتأكيد ليس بينها الحديث للإعلام.
في كل مرة يتحدث فيها ثروت سويلم للإعلام، يتسبب في سوء فهم أو مشكلة كبيرة أو على أقل تقدير لا يعطي الإضافة المرجوة منه كمسؤول في كرة القدم كل المطلوب منه هو التوضيح أو الإعلان عن قرار معين.
مهارة الحديث الإعلامي واحدة من أهم المهارات المطلوبة لأي شخص في العمل العام، عليك أن تتقنها أو تعمل في صمت لكي لا تتسبب في مشكلة دون داع يذكر.
وفي هذا المقال سنتحدث عن بعض تصريحات ثروت سويلم والتي تسببت في بعض المشكلات.
""مرتضى منصور حريص على تتويج الزمالك ببطولة لذلك سيكون حكام المباراة النهائية مصريين"".
قبل نهائي كأس مصر 2018 كان هناك خلاف حول ما إذا كان طاقم تحكيم المباراة سيكون مصريا أم أجنبيا ليخرج سويلم قبل المباراة ويقول إن الطاقم سيكون مصريا.
هل من الطبيعي أن يقول مسؤول باتحاد الكرة إننا قد عينا حكم بعينه بناء على طلب أحد الأندية؟
بكل تأكيد هذا تصريح لا يعقل ولا يمكن أن يخرج من مسؤول حتى لو كانت نيتك سليمة فهو تصريح غير طبيعي، حتى بعدما حاول سويلم إصلاح الخطأ فيما بعد عندما قال إن هناك اختلاقات بين وجهات النظر ولكن في النهاية اتحاد الكرة هو من سيصدر القرار النهائي.
بالفعل تم تعيين محمد فاروق حكما للمباراة وفاز الزمالك وبالتالي كان فاروق عرضة للضغوط والنقد والتشكيك باحتساب هدف فوز الزمالك، ليس لشيء إلا ضغط وضعه فيه سويلم قبل حتى تعيينه.
""يجب أن تعمل حساب للأهلي والزمالك، والإسماعيلي بجماهيره، الأندية الشعبية لها حسابات في التعامل"".
""الوضع الطبيعي لازم تعمل مجاملات أو حسابات للأهلي نادي القرن والوضع الطبيعي في وجود المستشار رئيس للنادي تعمل حسابات في التعامل معه"".
أي مشجع أو متابع لكرة القدم قد يميل لكفة الأندية الشعبية على حساب أندية الشركات ولكن هذا شيء يخص الجماهير، كمسؤول أنت ارتضيت تواجد أندية الشركات لذلك يجب أن تعاملها كأي فريق آخر من الأندية الشعبية وأن تطبق مبادئ المساواة على الجميع سواء في القرارات أو التصريحات لأن المساواة هي أكبر شيء تفتقده الكرة المصرية على مدار تاريخها.
""وجود الزمالك في بطولة السوبر إضافة كبرى لكن حتى الآن لم يحدث أي جديد. مشاركة الفريق في البطولة بشكلها الجديد واردة مع تغيير مجلس الإدارة"".
""ربما يحب الكل أن يكون هناك جديد في التعامل مع الزمالك بعد تغيير الإدارة"".
""الإدارة الجديدة ربما ستقول أننا لم نعتذر عن النسخة الماضية ونريد بدء صفحة جديدة"".
""كان يجب صدور القرار بعقوبة الزمالك بعد انسحابه من النسخة الماضية لبطولة السوبر وهذا لم يحدث فهذا وكأنك تركت جزء من الباب مفتوحا"".
الزمالك كان قد اعتذر عن عدم خوض كأس السوبر المصري 2022 بالتالي أصبح ممنوعا من المشاركة في النسخة التالية حسب اللوائح ولكن في كل مرة كان يتحدث ثروت سويلم عن إمكانية مشاركة الزمالك بعد تغيير مجلس الإدارة ولأن وجوده تسويقيا مهم للبطولة.
بكل تأكيد مشاركة الزمالك تسويقيا مهمة لأي بطولة مصرية بسبب جماهيره الكبيرة ولكن ما علاقة ذلك بتطبيق اللوائح، هل اللوائح تختلف عندما يكون الفريق جماهيريا أو لا؟ وما علاقة تغيير مجلس إدارة الزمالك بموقفه من المشاركة في السوبر، في النهاية العقوبة كانت ضد الكيان وليس مجلس الإدارة.
في النهاية لم يتطرق الكثيرون لتصريحات ثروت سويلم كون اللوائح قد نفذت بشكل طبيعي ولم يشارك الزمالك في البطولة، ولكن كالعادة التصريحات جانبها التوفيق واعتبرت كمجاملة للنادي رغم إنه لم يستفد شيء.
""أتعجب من الحديث عن مجاملة الأهلي. الزمالك أيضا تأجل له مباريات ولكن بقدر أقل لأن مشاركات الأهلي الخارجية تفوقه. رابطة الأندية ونظامها لعب دورا في فوز الفريقين بدوري الأبطال والكونفدرالية"".
""إصرار الزمالك على موقفه؟ ""مفيش حاجة اسمها كده وكل واحد يقول اللي هو عايزة وفي النهاية في إدارة محترمة تحكمها لوائح ونظام لازم يتطبق"".
""مع احترامي لنادي الزمالك ولكنه بعيد عن المنافسة حتى يتحدث عن ضرورة اللعب بترتيب المباريات. نحن نعاني من ضيق الوقت ونحاول الوصول إلى أفضل نظام لتسيير المسابقة"".
الزمالك قرر عدم استكمال الدوري بعد الخسارة من المصري في الموسم الماضي لأنه يرى أن الفريق قد تعرض لظلم تحكيمي كبير مع عدم وجود مساواة في ترتيب المباريات وبالفعل اعتذر الفريق عن عدم مواجهة الأهلي كاعتراض على عدم تنفيذ مطالبه.
ولأول مرة لا يتحدث ثروت سويلم بنبرة المجاملة لأحد الفرق ولكنه أيضا تسبب في مشكلة جديدة ولكن تلك المرة دخل في صدام مباشر مع الزمالك.
مجلس إدارة الزمالك اعتبر تصريحات سويلم إهانة للنادي لأنه قال إن الزمالك خرج من المنافسة على الدوري ولا يحق له الاعتراض وتحولت المشكلة من رغبة الزمالك في تنفيذ بعض المطالب لدخول النادي في صدام مع أحد أعضاء رابطة الأندية قبل أن يعتذر ثروت سويلم عن تصريحاته التي تم فهمها بشكل خاطئ كما أشار.
""إذا أمن العقاب أساء الأدب. هذا زمن أندية البيانات وكل من استيقظ صباحا يصدر بيان. الإساءة لاتحاد الكرة والرابطة غير مقبولة، ويجب أن يكون هناك رد فعل عنيف ضد من كتب هذا الكلام"".
""من كتب البيان هو أحد العاملين بالنادي ويريد أن يظهر لملاكه أنهم ""رجال"" ويهاجموا الرابطة واتحاد الكرة"".
أساس عمل هؤلاء الأشخاص هو الاستفادة المادية من ملاك النادي، وبالتالي لا يعنيهم الأمر ولذلك أقول أن من أمن العقاب أساء الأدب"".
""إنهم يتربحون من ملاك النادي وبمبالغ خيالية، ويريدون أن يصوروا للملاك أنهم يحاربون من الرابطة لكي لا يفوزوا بالدوري"".
بعد القرار بإستكمال مباراة سموحة وبيراميدز الشهيرة من حيث توقفهما والتي لم تستكمل بسبب حريق في استاد الإسكندرية اعترض بيراميدز على القرار لرغبة النادي في اعتباره فائزا كون الأزمة حدثت في ملعب سموحة المضيف.
بعد بيان بيراميدز الاعتراضي خرج ثروت سويلم وهاجم إدارة بيراميدز وأتهمهم أن الإدارة هدفها فقط التربح المالي من الملاك بدون وجه حق أو بدون النظر لمصلحة النادي.
ما علاقة رد سويلم على إدارة بيراميدز بقرار رابطة الأندية، قد ترى أن إدارة بيراميدز مخطئة في بيانها وقد يرد المسؤولين عن البيان بشكل طبيعي سواء بقرارات تأديبية إذا لم يعجبك محتوى البيان أو عن طريق اللوائح بدلا من شخصنة الأمور وتحويلها من أمر رياضي إلى الدخول في زمم الناس وإحداث ضجة وصراع من لا شيء ولحسن الحظ لم يرد أعضاء بيراميدز على تصريحات وإلا كانت الأزمة ستضخم بشكل أكبر.
""نهائي كأس مصر بدون الأهلي والزمالك لم يكن بالشكل الذي يتمناه الجمهور. من الوارد تغيير لائحة المشاركة في كأس مصر من أجل مصلحة البطولة وليس لمجاملة الأهلي لكي يشارك في الكأس الموسم المقبل"".
من جديد يتحدث ثروت سويلم حول ضرورة تواجد نادي معين في بطولة على الرغم من أن ذلك يخالف اللوائح.
الأهلي اعتذر عن عدم خوض بطولة كأس مصر في نسخته الماضية بسبب ضرورة حصول لاعبيه على راحة وهذا من جديد يعني أنه لن يشارك في النسخة التالية حسب اللوائح مثلما حدث مع الزمالك في السوبر.
وبدون أسباب أو مناسبة، يخرج ثروت سويلم ويتحدث عن إمكانية تغيير اللوائح لمشاركة الأهلي على الرغم من أن النادي لم يطلب والبطولة حتى لم يقترب موعدها، فلماذا التبرع بتصريحات تثير اللغط.
ثروت سويلم لا علاقة به بكأس مصر من الأساس كونه عضوا في رابطة الأندية وليس في اتحاد الكرة، لذلك فهو غير مسؤول عن تنظيم كأس مصر أو لوائحه أو أي شيء، فكيف يتحدث عن البطولة وتغيير اللوائح وهو غير مسؤول عن البطولة من الأساس، ولماذا دائما يرتبط حديث ثروت سويلم بمجاملة الأندية التي تجد نفسها في موضع اتهام بمجاملة لم تنلها من الأساس.
""الأغلب سيكون الدوري كما هو بنفس نظامه، وكل الأندية سترفض إقامة الدوري بأي شكل آخر وستظل أزمة الدوري المصري لسنوات طويلة والموسم لن ينتهي قبل شهر سبتمبر عام 2025"".
أمس الأحد، كشف سويلم عن اقتراب خوض دوري الموسم الجديد بشكله المعتاد بنظام دورين ومجموعة واحدة وحذر من أن ذلك سيجعل الموسم ينتهي في شهر سبتمبر من العام المقبل.
وفقا لرابطة الأندية، فإن الدوري الجديد سيبدأ في الأسبوع الأخير من شهر أكتوبر وفي حالة خوضه بالشكل الطبيعي ونهايته في سبتمبر التالي يعني أن الدوري سيستمر 11 شهرا.
هل من الطبيعي أن يستمر دوري عادي من 34 جولة لمدة 11 شهرا؟
إذا أجرينا مقارنة سريعة بين حالة فرق الدوري المصري والدوريات الأوروبية من حيث المواعيد سنجد أن الدوريات الأوروبية تلعب عدد مباريات أكبر بكثير.
على سبيل المثال سنجعل الأهلي هو طرف المقارنة، سيلعب 34 مباراة في الدوري المصري و3 مباريات بحد أقصى في بطولة إنتركونتيننتال و12 مباراة من دور المجموعات حتى نهاية دوري أبطال إفريقيا ومباراتين بكأس السوبر المصري سيتم لعبهم قبل بداية الموسم على الأرجح. إجمالي 56 مباراة على الأكثر.
وسنضع ريال مدريد كطرف المقارنة الثاني، سيلعب مباراة ببطولة إنتركونتينيننتال و18 مباراة بحد أقصى في دوري أبطال أوروبا و6 مباريات بحد أقصى في كأس ملك إسبانيا ومباراتين بكأس السوبر الإسباني بالإضافة إلى كون الدوري الإسباني مكون من 38 جولة وليس 34 وستجد هنا أن ريال مدريد سيخوض عددا أكبر بكثير من الأهلي أكثر فريق قد يخوض مباريات في مصر ثم سيلعب كليهما كأس العالم للأندية بشكل طبيعي بعد نهاية الموسم. إجمالي 65 مباراة على الأكثر.
في مصر يقول ثروت سويلم إن بهذا الشكل سينتهي الدوري في شهر سبتمبر، أما في إسبانيا وأوروبا سينتهي الدوري بشكل طبيعي في مايو، هل من المعقول أن نبدأ الدوري المصري بعد الدوريات الأوروبية بشهرين وننهيه بعد نهاية الدوريات بأربعة أشهر؟
مع العلم أن الدوري المصري لن يتخلله أي بطولات قارية طويلة لمنتخب مصر أو الأهلي أو الزمالك أو غيرهم فلن يتوقف الدوري في أي مناسبة لمدة طويلة فلماذا قد يمتد لكل تلك الفترة الطويلة حسب تصريحات ثروت سويلم.
الخلاصة هي أننا نريد بالفعل خوض موسم استثنائي في الدوري المصري ولكن لكي تكون مواعيده في المواسم التالية متماشية مع مواعيد باقي دوري العالم وليس من أجل أن ننهي الدوري في 8 أشهر على أقصى تقدير، لأن تلك المدة هي الطبيعية أو حتى لدوري يلعب من 34 جولة فقط مثل الدوري الألماني الذي يبدأ بشكل متأخر عن باقي الدوريات الكبرى ويحصل على فترة راحة طويلة في نصف الموسم وينتهي بشهر مايو بشكل طبيعي.
التصريحات السابقة هي أمثلة فقط على تصريحات كثيرة لم يكن ثروت سويلم فيها موفقا سواء في إحداث سوء فهم أو حتى في الإدلاء بتصريحات غير واقعية وكان يتم نفيها في الكثير من الأوقات مع خروج القرارات الرسمية.
الخلاصة هي أن ثروت سويلم رجل مسؤول في الكرة المصرية، مثله مثل العديد من المسؤولين الذين يمارسون مهام عملهم وينجحون في بعضها ولا يوفقون في أخرى ولكن تظل مشكلته الأكبر دائما في كثرة التصريحات التي لا تعبر عن الواقع فتدخله في المشكلات، وذلك فنحن ننادي السيد سويلم. أرجوك كفاك تصريحات، فنحن لدينا ما يكفي من إثارة في الكرة المصرية بالفعل دون الحاجة للغط تصريحاتك.
ومع تلك التصريحات المتضاربة يجب أن يكون لرابطة الأندية ولاتحاد الكرة متحدثا رسميا لكل منهما، لا يخرج أحد غيره للحديث عن القرارات التي تخصمها ويوضح ما يريد الإعلام استيضاحه ولا يجب أن يتحدث كل مسؤول بما يراه صحيحا دون النظر إلى ما إذا كان كلامه سيتم تنفيذه أو لا، لأن المشاهد يهتم فقط بالقرارات الرسمية وليس فيما يفكر فيه المسؤولين عن كرة القدم ولأن ذلك التفكير بصوت عالي يحدث أحيانا نوعا من اللغط بين القرارات الرسمية وما يفكر فيه المسؤول."
الكرة الإفريقية,"يقدمFilGoal.comتغطية حية ومباشرة لمباراة صنداونز ضد الأهلي في ذهاب نصف نهائي دوري أبطال إفريقيا.
ويستعد الأهلي للقاء صنداونز في ذهاب نصف نهائي دوري أبطال إفريقيا، ملعب لوفتوس فيرسفيلد.
وكان الأهلي قد تخطى عقبة الهلال السوداني بالفوز بنتيجة 1-0 في كل مباراة ذهابا وإيابا.
وانتصر صنداونز على الترجي التونسي بنتيجة 1-0 في مجموع المباراتين للوصول للمربع الذهبي.
ق 90+2: انفراد بنشرقي وهدف للأهلي لكن الحكم المساعد يشهر راية التسلل
ق 89: تغييران للأهلي بمشاركة أكرم وبنشرقي بدلا من رضا وجراديشار
ق 71: جوووول أووووول ولكن جراديشار والحكم يشهر راية التسلل على داري
ق 59: مطالبات بركلة جزاء بداعي وجود لمسة يد على مدافع صنداونز بعد رأسية طاهر
ق 44: عرضية إمام ورأسية من جراديشار ترتطم بالقائم الأيسر لصنداونز
ق 37: ركنية خطيرة من لوكاس ريبيرو يبعدها الشناوي بقبضة يده قبل أن تسكن الشباك
ق 34: تصويبة من لوكاس ريبيرو تمر بجوار القائم دون خطورة على مرمى الشناوي
ق 30: رأسية إمام سهلة في يد الحارس بعد عرضية محمد هاني
ق 20: تمريرة بينية من رضا لجراديشار في عمق دفاع صنداونز لكن ويليامز يخرج ويشتت الكرة في الوقت المناسب قبل السلوفيني.
ق 15: تصويبة قوية من إمام في منتصف المرمى يتصدى لها ويليامز بثبات
ق 10: تصويبة قوية من موكوينا تمر بسلام أعلى العارضة"
كرة السلة الأمريكية,"نجح لوس أنجلوس كليبرز في الفوز على دنفر ناجيتس في سلسلة الدور الأول من الأدوار الإقصائية للقسم الغربي من دوري كرة السلة الأمريكية NBA.
وفاز كليبرز ليعادل السلسلة وتصبح نتيجتها 1-1، وذلك بعدما انتصر بنتيجة 105-102.
وشهدت المباراة تألق كواي ليونارد نجم لوس أنجلوس كليبرز الذي سجل 39 نقطة.
على الجانب الآخر سجل نيكولا يوكيتش نجم دنفر ناجيتس 26 نقطة.
في مباراة أخرى في القسم الشرقي نجم ديتوريت بيستينز في معادلة السلسلة مع منافسه نيويورك نيكس بالفوز عليه بنتيجة 100-94، لتصبح السلسلة نتيجهتها 1-1.
وتألق كيد كانينجهام نجم ديترويت وسجل 33 نقطة، وأكمل 12 متابعة.
بينما سجل جالين برونسون نجم نيويورك نيكس 37 نقطة في المباراة."
الكرة المصرية,"يرغب الاتحاد المصري لكرة القدم في إسناد مباراة الزمالك وبيراميدز في نهائي كأس مصر لطاقم تحكيم مصري.
وحدد اتحاد الكرة يوم 20 مايو المقبل موعجدا لمباراة الزمالك وبيراميدز في نهائي كأس مصر.
وحسبما علمFilGoal.comفإن اتحاد الكرة يرغب في إسناد مباراة الزمالك وبيراميدز في نهائي كأس مصر لطاقم تحكيم مصري، لكنه لا يمانع استقدام طاقم أجنبي حال طلب أحد الناديين ودفع القيمة المالية.
وعلمFilGoal.comفي وقت سابق أن بيراميدز قد تقدم باعتراض على موعد المباراة لعدم تكافؤ الفرص، إذا سيحصل الزمالك على راحة لمدة 7 أيام بينما يخوض بيراميدز مباراة في الدوري يوم 17 مايو.
ويتلقي بيراميدز مع بتروجت يوم 17 مايو في الدوري، بينما يلعب الزمالك مباراه الأخيرة ضد بيراميدز يوم 13 في الدوري قبل مواجهته من جديد في الكأس.
وتأهل الزمالك وبيراميدز لنهائي كأس مصر 2024-25، بالتفوق على سيراميكا كليوباترا والبنك الأهلي على الترتيب.
وكشف اتحاد الكرة عبر حسابه الرسمي عن إقامة المباراة يوم 20 مايو.
وذكر الاتحاد أنه سيتم تحديد ملعب المباراة وكافة الترتيبات في وقت لاحق.
ويأتي تحديد ذلك الموعد بعد خروج الزمالك وبيراميدز من دور المجموعات لبطولة كأس عاصمة مصر (كأس الرابطة).
ومن المقرر أن يقام إياب ربع نهائي كأس العاصمة يوم 20 و21 مايو.
وكان مصدر من اتحاد الكرة كشف سابقا عن تأخر موعد الإعلان لـFilGoal.com: ""لم نحدد موعد نهائي كأس مصر لعدة أسباب أبرزها معرفة موقف بيراميدز من المشاركة القارية"".
وتأهل بيراميدز إلى نصف نهائي دوري أبطال إفريقيا لمواجهة أورلاندو بايرتس الجنوب إفريقي.
ويلتقي بيراميدز أمام أورلاندو بايرتس في ذهاب نصف نهائي الكأس يوم السبت 19 إبريل، قبل خوض مواجهة الإياب يوم الجمعة 25 إبريل.
ويقام نهائي دوري أبطال إفريقيا يومي 24 مايو و1 يونيو.
وفي حالة تأهل بيراميدز إلى المباراة النهائية سيلتقي أمام الفائز من مواجهة الأهلي أمام صنداونز الجنوب إفريقي.
وفي مسابقة الدوري، من المنتظر أن ينهي بيراميدز مشواره في الدوري المصري بلقاء سيراميكا كليوباترا يوم 28 مايو المقبل.
بينما يختتم الزمالك موسمه بلقاء فاركو في الأول من يونيو المقبل."
الكرة الإفريقية,"أكد نادي بيراميدز أن ثنائي الفريق رمضان صبحي وفيستون ماييلي لم يتعرض للطرد عقب مباراة أورلاندو بايرتس الجنوب إفريقي.
وقال المصدرلـFilGoal.com:""لم يتم طرد رمضان صبحي أو فيستون ماييلي عقب مباراة أورلاندو"".
وأضاف ""الثنائي حصل على إنذار فقط وهذا ما تم تسجيله في تقرير الحكم"".
وتعادل بيراميدز مع منافسه أورلاندو بايرتس بدون أهداف في المباراة التي جمعتهما في ذهاب دور نصف النهائي من بطولة دوري أبطال إفريقيا.
وأقيمت المباراة على ملعب سوكر سيتي في جنوب إفريقيا.
وشهدت المباراة إثارة كبيرة من بيراميدز الذي سجل هدفين عن طريق فيستون ماييلي وصديق أوجولا لكن لم يحتسبا.
ويلعب بيراميدز ضد أورلاندو بايرتس يوم الجمعة المقبل الموافق 25 أبريل الجاري في مباراة العودة لنصف نهائي دوري أبطال إفريقيا.
وتنطلق المباراة في تمام الساعة التاسعة مساء بتوقيت القاهرة."
