title,body
الكرة المصرية,"لا حديث يعلو فوق الحديث عن رحيل زيزو المؤكد من الزمالك والاقتراب من الانتقال إلى منافس الأبيض الأزلي الأهلي.
لكن كم مرة توجه الاهتمام إلى مستقبل الزمالك الإداري والكروي؟ بكل ثقة صفر، لا يوجد أي حديث عن مستقبل الزمالك الإداري، لماذا الإداري بالأخص؟ لأن ما يحدث في إدارات من قرارات حاسمة وتوفير الأجواء المساعدة للنجاح هو ما يطبق في أرض الملعب.
شبه مستحيل أن ينجح فريق في أرض الملعب بدون نجاح إداري، أعلم أن مشجع الزمالك سيقول حدثت من قبل مع فريقي كثيرا، لكن هذا يسمى استثناء، إلى متى ستذهب وراء الاستثناءات وتجعلها قواعد دون صناعة النظام الصارم حيث لا يوجد عاطفة؟
طيلة سنة ونصف الزمالك لا يملك المال لتجديد عقد زيزو الذي يعتبر بمثابة الوعد الانتخابي الأقوى لمجلس الإدارة الحالي، ثم عندما امتلك المال بعد رفض العديد من العروض الدولارية، كان زيزو قد ذهب بعيدا بسرعته الكبيرة، رغم جميع وعوده للجماهير، لنا عودة في هذه النقطة بالتحديد لاحقا.
تعاقبت وتغيرت إدارات الزمالك أكثر من عدد سنوات شاب عشريني، ولم تتعلم الدرس أبدا.
كم مرة راهنت إدارة الزمالك على ما يسمى انتماء ورغبة ووعود لاعب ما؟ منذ رضا عبد العال مرورا بمعتز إينو وطارق السعيد ومحمد صديق وإمام عاشور وحاليا يقترب زيزو.
العدد الصفر سيأتي إلى هنا مرة أخرى لأنه أكثر ما يمكن أن يعبر عن سوء إدارة الملفات، وليس ماليا فقط، لأني أعلم أن المشجعين العاطفيين سيوقولون لا يوجد المال اللازم أو اللاعب وعد بعدم رحيله للأهلي أو لن يرتدي قميص إلا الزمالك في مصر.
وفي النهاية تكتشف أنها وعود كاذبة، لكن أنت كمشجع من الممكن أن يتم خداعك من قبل اللاعب، لكن إدارة بحجم نادي مثل الزمالك، كيف يحدث ذلك؟
إذا يتم خداع إدارة الزمالك أكثر من مرة، فلماذا لا يدير مشجع ستيني للزمالك النادي لأنه يحبه دون أي مصلحة، لن يكون هناك أي فارق على الإطلاق، إذا كان المقدار هو ""الحب"".
الفارق بين الإدارة والمشجع، أن الأول يعلم مصلحة النادي أكثر كونه يعيش داخله ويعلم كيف يفكر هذا اللاعب وهذا المدرب.
عندما لا تتمكن من معرفة هذا الشيء ويتم خداعك من أي لاعب فعليك مراجعة عملك فورا، لأن هذا غير مقبول.
أكثر ما يحدث لصالح إدارة أي نادي أن غضب جماهيره ينصب فقط على اللاعب الذي يبحث عن مصلحته مهما كانت كلماته بحب النادي، لا تصدق اللاعب إلا عندما يعتزل، وهذا ما يطبق على أسطورة الزمالك وهدافه التاريخي عبد الحليم علي، الذي رفض قطعيا اللعب للأهلي بل لأي فريق مصري وفضل الاعتزال وظل في قلوب جميع مشجعي الزمالك ويحصل على تحية الجماهير في أي مناسبة.
نعود للاختباء، دون توجيه اللوم على الإدارة لن يحدث أي تطور للزمالك واليوم سيكون زيزو وغدا حسام وبعده محمد وهكذا، ستختلف الأسماء والسياسة المتبعة واحدة والرهان على لاعبين كرة القدم هي مهنتهم، وأنت لا تتبع طرق مختلفة، سوى أن هذا اللاعب خدعني، وذلك أقسم لي بعدم الرحيل، وآخر أقسم لي بنجلته بعدم لعبه لأي فريق غير الزمالك في مصر، هل هذا منطق؟
لا تحدث هذه الأشياء في أي ناد أو مؤسسة، حدة الكلمات تناسب عظمة الزمالك وتاريخه.
عندما نجح مجلس إدارة الزمالك في الانتخابات كان من المفترض أنه على علم بديون النادي والمشاكل التي يمر بها، كيف والمشجعين أنفسهم على علم بها!
في هذا الجانب، لا يوجد إلا حلين يقبلهم العقل، الحل الأول أن الإدارة لديها الحلول والأساليب السحرية للتغلب على هذه العقبة سواء بتحسين موارد النادي - الجملة التي يسمعها كل مشجع للزمالك طيلة حياته - أو ستتبع أسلوب علمي.
من الواضح أن الإدارة لا تملك الحل السحري والأسرع وهذا منطقي، ففي النهاية النادي ليس ملكية خاصة كي يصرف المالك ويحل الأمور.
لكن ما هو الحل الآخر؟ تتذكر عرض نادي نيوم من أجل زيزو الذي وصل إلى حوالي 6 ملايين دولار ورفضته إدارة الزمالك دون سبب منطقي، في هذا التوقيت ظن الجميع أن فقط أيام وسيجدد زيزو عقده وتنتهي هذه القصة أول عن آخر، لكنها كانت البداية.
الزمالك رفض العرض ولم يفعل أي شيء حتى شهر يناير الماضي وتلقى عرضا من الاتفاق السعودي حوالي 3 ملايين دولار ورفض أيضا، وسيرحل بنهاية الموسم الجاري مجانا.
دعني أقول لك إنني كنت رافضا لهذه العروض، لماذا؟ لأن طوال 3 فترات انتقالات صرف الزمالك الكثير من الأموال دون بناء فريق بجودة قوية، فريق الزمالك أضعف من الأهلي وبيراميدز فرديا وجماعيا.
التعاقد مع لاعبين أصحاب جودة ضعيفة وضم أكثر من 20 لاعبا ولا ينجح سوى 3-4 لاعبين، هذا ما جعل الجميع يرفض التفريط في زيزو، لأنك لا تستطيع التعاقد مع لاعبين أقوياء، وهذه وجهة نظر أتفق معها بشكل كامل.
ولكن ماذا لو كنت تملك لجنة التخطيط في وقت مبكر أو ما يساويها في عملها كمدير رياضي أو لجنة كرة، مهما كان المسمى؟ بالتأكيد بيع لاعب بهذا المبلغ الخيالي واستقطاب محترفين في قيمة أشرف بنشرقي وفرجاني ساسي وليس كونراد ميشالاك البولندي الكارثي.
بالتالي عندما كتبت أن المسألة ليس أموالا فقط، فأقصدها بالضبط، لأن لا توجد قاعدة بمن يصرف أكثر يفوز.
هذه الجملة ستنقلنا لناد بظروف مشابهة وعليه ديون بأكثر من 400 مليون يورو في وقت من الأوقات، ودائما ما يتبع رئيس هذا النادي هذه المقولة ويقولها كثيرا.
إذا قلت لك إن جيوزيبي ماروتا رحل من يوفنتوس بسبب رفضه التعاقد مع كريستيانو رونالدو ستقول ما هذا الجنون! رحل بسبب رفضه صفقة ضم رونالدو في أفضل أيامه من ريال مدريد إلى يوفنتوس؟ نعم رفضها وبسببها رحل.
ماروتا كان المدير الرياضي ليوفنتوس وقتها ورفض الصفقة كليا بسبب أنها ستؤثر على اقتصاد النادي وسيضطر لبيع أكثر من لاعب وبالتالي الجودة الجماعية ستنخفض وهذا أهم من امتلاك نجم وواحد من أفضل اللاعبين في تاريخ اللعبة مثل رونالدو، لأن كرة القدم لعبة جماعية وليست تنس.
رحل ماروتا، واغتنم الصيني ستيفين زهانج رئيس إنتر الفرصة ليقدم له عرض مقابل 3 ملايين يورو سنويا ويكون المدير الرياضي الأعلى أجرا في إيطاليا، ومقابل ذلك سيتحكم تحكم كلي في فريق كرة القدم بالنادي.
لم يحقق إنتر أي بطولة منذ 2011 حتى جاء ماروتا وسيطر على البطولات حتى جاءت جائحة كورونا، وتعرض إنتر بمالكه الصيني بأصعب ظروف مالية جعلته يترك لوكاكو وأشرف حكيمي والأهم أنطونيو كونتي المدرب.
هل سقط النادي؟ لا، بل فاز بالألقاب وبالدوري الـ19 مع كونتي والـ20 مع إنزاجي والوصول لنهائي دوري أبطال أوروبا 2023 بجانب عدة كؤوس إيطاليا والسوبر الإيطالي.
في هذه الفترة اعترضت جماهير إنتر واحتجوا أمام المقر الإداري لبيع لوكاكو وحكيمي ونجوم الفريق.
ماروتا رد قائلا على هذه الاعتراضات، ليس شرطا أن يفوز من يدفع أكثر، وتحققت هذه المقولة على أرض الملعب بالنتائج والأداء.
إنتر كان مديونا بأكثر من 400 مليون يورو واستمر بالتتويج بالبطولات تحت قيادة ماروتا الذي أصبح رئيس النادي حاليا.
ومن المتوقع أن خلال العام المالي الحالي أو المقبل أن تكون ميزانية إنتر بالإيجاب للمرة الأولى منذ سنوات عديدة مر خلالها بعقوبات كبيرة من الاتحاد الأوروبي لكرة القدم بسبب قانون اللعب المالي النظيف.
أي مر إنتر بظروف أصعب بكثير من الزمالك في الجانب المالي، لكن وجود إدارة ونظام في التعاقد مع اللاعبين وتعيين المدربين والإداريين تخطى إنتر هذه الصعاب.
هذا ما ينقص الزمالك في الأساس، لا تقول لاعبين أو مدربين أو أموال أو أو... فقط نظام إداري سيجعل كل شيء على ما يرام، وهذا ما يجب التركيز عليه من إدارة الفارس الأبيض، دون ذلك ستتكرر أزمة زيزو أكثر من مرة قريبا.
صحيفة كورييري ديلو سبورت نشرت عقب تأهل النيراتزوري لنصف نهائي دوري أبطال أوروبا أن أكثر 11 لاعبا يشارك في التشكيل الأساسي للفريق، هم ليسوا الأعلى قيمة سوقية في إيطاليا وليس أوروبيا حتى.
تشكيل إنتر الأساسي تبلغ قيمته السوقية 291 مليون يورو وهو رابع أكبر قيمة سوقية في إيطاليا، هل تتخيل هذا؟ يأتي يوفنتوس أولا بـ504 مليون يورو، ثم ميلان ثانيا بـ354.4 مليون يورو، وثالثا نابولي 350.4 مليون يورو.
أجرى أليساندرو باستوني حوارا بعد التأهل لنصف نهائي دوري أبطال أوروبا مع لا جازيتا ديلو سبورت وقال جملة تلخص الأمر: ""إنتر هو أقل الفرق الـ3 فرديا، لكن جماعيا يمكننا الفوز على أي فريق"".
هذه الجملة تعلمك أن عقلية ماروتا انتقلت إلى اللاعبين والفريق أن كرة القدم لعبة جماعية وليس بالأموال فقط، لكن بكيفية صرف الأموال القليلة التي تمتلكها، وهذا ما يفتقره الزمالك أكثر من الفقر المالي حقا.
دور لجنة التخطيط في الزمالك حاليا هام للغاية بما أنها مكلفة من مجلس الإدارة لتكوين فريق قوي دون رفاهية ضم لاعبين للتجربة."
الكرة الإفريقية,"حدد نهضة بركان المغربي سعر بيع أيوب خيري نجم وسط الفريق وسط اهتمامات الأندية الخارجية.
وانضم أيوب خيري إلى نهضة بركان من شباب الرجاء في صيف 2021 ويرتبط بتعاقد حتى صيف 2027.
وكشف موقع أفريكا فوت عن جذب لاعب وسط نهضة بركان اهتمام العديد من الأندية الكبرى خارج المغرب.
وأشار التقرير إلى رغبة ناديي مونبيلييه ولو هافر في فرنسا بجانب اتحاد جدة في السعودية وتقديم عروض جادة لضم أيوب خيري.
وأوضح التقرير أن نهضة بركان حدد سعرا مبدئيا بـ 5 ملايين دولار من أجل بيع اللاعب.
وحسم أيوب خيري لقب الدوري المغربي للمرة الأولى في تاريخ نهضة بركان قبل خمس جولات من النهاية.
كما قطع نهضة بركان شوطا نحو نهائي بطولة الكونفدرالية الإفريقية.
وكان نهضة بركان قد تغلب على شباب قسنطينة بأربعة أهداف دون مقابل في ذهاب نصف النهائي.
ولعب أيوب خيري 34 مباراة مع نهضة بركان هذا الموسم في مختلف المسابقات وساهم في 10 أهداف."
الدوري الإسباني,"كشفت صحيفة توتوسبورت الإيطالية عن وجود اهتمام من برشلونة بالتعاقد مع مويس كين لاعب فيورنتينا.
وأشارت الصحيفة إلى أن برشلونة يستهدف التعاقد مع مويس كين لخلافة روبرت ليفاندوفسكي الذي بلغ من العمر 37 عاما.
كشافو برشلونة تابعوا كين والأداء الذي يقدمه طوال الموسم ويرونه كتعاقد محتمل لتقوية الفريق.
وينتهي تعاقد ليفاندوفسكي مع برشلونة بنهاية الموسم المقبل ولذلك يبحث النادي عن مهاجم لخلافته.
وشارك كين منذ بداية الموسم الحالي بقميص فيورنتينا في 39 مباراة بجميع البطولات وتمكن من تسجيل 23 هدفا وصناعة 3 أهداف.
ويحتل برشلونة حاليا صدارة جدول ترتيب الدوري الإسباني بفارق 4 نقاط عن ريال مدريد صاحب المركز الثاني.
كما وصل الفريق لنصف نهائي دوري أبطال أوروبا ونهائي كأس ملك إسبانيا."
ميركاتو,"يسعى نادي مانشستر سيتي للحفاظ على برناردو سيلفا لاعب الفريق وتمديد تعاقده لموسم آخر.
برناردو سيلفا البالغ من العمر 30 عاما هو أحد المرشحين لمغادرة سيتي عقب نهاية الموسم الجاري.
وكشف موقع givemesport عن رغبة مانشستر سيتي في تمديد التعاقد لمدة موسم آخر.
وأشار التقرير إلى اهتمام فريقي بنفيكا وبرشلونة في ضم اللاعب البرتغالي.
وأوضح التقرير أن برناردو سيلفا الذي يحصل على راتب أسبوعي بقيمة 300 جنيه إسترليني لم يحسم موقفه من العروض المقدمة.
وتدرج برناردو في صفوف بنفيكا قبل الاحتراف في صفوف موناكو عام 2014.
وانتقل الدولي البرتغالي من موناكو إلى مانشستر سيتي في صيف 2017.
وارتدى برناردو سيلفا قميص الفريق السماوي في 396 مباراة وسجل 70 هدفا.
وحقق مع سيتي العديد من البطولات، أبرزها 6 ألقاب دوري إنجليزي ولقب دوري أبطال أوروبا 2023 ولقب كأس العالم للأندية 2023."
الكرة الأوروبية,"يدرس نادي بورتو قطع إعارة لاعبه تياجو ديالو وإعادته إلى يوفنتوس.
وحسب صحيفة أبولا البرتغالية فإن بورتو بصدد قطع إعارة ديالو لعدم التزامه.
وأفادت الصحيفة فإن ديالو رفقة 3 لاعبين آخرين كسروا قواعد النادي بالخروج ليلا.
ولم تكن هذه الواقعة هي الأولى للمدافع البرتغالي، فإن ديالو سافر إلى مدينة مدريد ليلة رأس السنة وعاد إلى تدريبات بورتو في اليوم التالي متأخرا.
وتعاقد بورتو مع اللاعب البالغ من العمر 25 عاما في فترة الانتقالات الصيفية الماضية على سبيل الإعارة من يوفنتوس.
وانضم ديالو إلى يوفنتوس في فترة الانتقالات الشتوية قبل الماضية مقابل 5 ملايين يورو قادما من ليل.
وانتقل ديالو إلى فريق ميلان تحت 19 عاما قادما من سبورتينج لشبونة البرتغالي مقابل مليون يورو في يناير 2019.
واستمر ديالو مع الروسونيري لمدة 6 أشهر فقط ورحل إلى ليل مقابل 4 ملايين يورو في صيف 2019.
وتوج ديالو من قبل ببطولة الدوري الفرنسي موسم 2020-2021 وبالسوبر الفرنسي 2021-2022."
الكرة الأوروبية,"اجتمع مسؤولو نادي اتحاد جدة مع نظيره برشلونة لبحث إمكانية ضم فرينكي دي يونج خلال فترة الانتقالات الصيفية المقبلة.
وينتهي عقد اللاعب الهولندي مع النادي الكتالوني في صيف 2026.
وحسب صحيفة سبورت الإسبانية فإن الاتحاد عقد اجتماعا مع برشلونة في الأيام الماضية من أجل التفاوض بشأن ضم اللاعب البالغ من العمر 27 عاما.
ووفقا لجريدة اليوم السعودية فإن لوران بلان المدير الفني للاتحاد يرغب في دعم خط وسط الفريق.
وحقق اتحاد جدة فوزا مثيرا على الاتفاق بثلاثة أهداف مقابل هدفين في مباراة أقيمت على ملعب الملك عبد الله بالجولة 29 من الدوري السعودي.
الفوز رفع رصيد الاتحاد للنقطة 68 في صدارة جدول الترتيب ليوسع الفارق مع الهلال صاحب المركز الثاني إلى 6 نقاط.
وسيلعب الاتحاد مباراته القبلة ضد النصر يوم الأربعاء 7 مايو، بينما يلتقي الاتفاق مع الخليج يوم 2 مايو."
سعودي في الجول,"يقود الكولومبي جون دوران هجوم النصر خلال المواجهة المرتقبة ضد ضمك.
ويحل النصر ضيفا على ضمك ضمن الجولة 29 من مسابقة الدوري السعودي.
فيما يغيب كريستيانو رونالدو عن صفوف النصر أمام ضمك تجنا لإرهاق النجم البرتغالي، إذ سيلعب النصر ضد يوكوهاما مارينوس الياباني بعد 3 أيام في ربع نهائي أطال آسيا للنخبة.
في المقابل يتواجد النجم المصري طارق حامد على مقاعد بدلاء ضمك في مواجهة النصر.
خط الدفاع: سلطان الغنام - محمد سيماكان - إيمريك لابورت - سالم النجدي
خط الوسط: مارسيلو بروزوفيتش - عبد الله الخيبري - أيمن يحيى
ويحتل نادي النصر المركز الثالث في جدول ترتيب الدوري السعودي برصيد 57 نقطة.
فيما يتواجد ضمك في المركز الـ11 بجدول الترتيب برصيد 31 نقطة."
الكرة الأوروبية,"يواجه نادي سانت إيتيان خطر خصم النقاط من رصيده في الدوري الفرنسي بعد إصابة مساعد حكم مباراته ضد أولمبيك ليون بمقذوف خلال لقاء الفريقين، حسب تقارير فرنسية.
وأوضحت جريدة ليكيب أن نادي سانت إيتيان قد يتعرض لخضم 3 نقاط من رصيده بسبب شغب جماهيره.
ومن المتوقع أن تفتح رابطة الدوري الفرنسي تحقيقاً رسميا، قد يسفر عن فرض عقوبات على سانت إيتيان منها اللعب بدون جماهير أو خصم نقاط.
وتعرض سانت إيتيان لعقوبات كثيرة في المواسم الأخيرة بسبب شغب جماهيره.
وكان أحد لاعبي ليون يستعد لتنفيذ رمية تماس قبل نهاية الشوط الأول بدقيقة، لكن الحكم المساعد وضع يده على رأسه بعدما أصيب بمقذوف من المدرجات.
وحاول الطاقم الطبي لليون علاج مساعد الحكم قبل أن يغادر الفريقان وطاقم التحكيم أرض الملعب نحو غرف خلع الملابس.
وتوقفت المباراة لأكثر من 40 دقيقة بعد إصابة الحكم المساعد.
وألقت الشرطة الفرنسية القبض على مشجع تسبب في إصابة مساعد حكم مباراة سانت إيتيان ضد أولمبيك ليون بمقذوف من المدرجات.
وأفاد نادي سانت إيتيان في بيان: ""بعد توقف المباراة اتخذ النادي على الفور جميع الإجراءات اللازمة لكشف الحقائق بدقة. وقد مكّن هذا التحقيق سريعًا من تحديد هوية الجاني المزعوم لإطلاق المقذوف"".
وأضاف ""استنادا إلى معلومات قدّمها النادي، وبالتعاون مع السلطات، أُلقي القبض على الشخص فور مغادرته الملعب. وهو الآن قيد الاحتجاز لدى الشرطة. وسيقدّم نادي سانت إيتيان شكوى ضده""
وشدد ""سيتخذ النادي أشدّ العقوبات من جانبه، حتى لا يفلت هذا العمل المنفرد من العقاب"".
وأتم البيان ""يُؤكّد سانت إتيان التزامه التام بمكافحة جميع أشكال العنف، وسيواصل العمل بحزم مع جميع الجهات المعنية لتمكين اتخاذ أشد التدابير ضد مرتكبي هذا النوع من الأعمال"".
وكان سانت إيتيان متقدما بهدف لوكاس ستاسين قبل توقف المباراة بسبب إصابة الحكم المساعد.
مع استئناف اللقاء ضاعف ستاسين النتيجة في الدقيقة 66.
ولم يكن الهدف الذي سجله تانر تسمان بعدها بـ10 دقائق كافيا لإنقاذ ليون من الخسارة."
الدوري المصري,"قرر الجهاز الفني للفريق الأول لكرة القدم بنادي الزمالك بقيادة البرتغالي جوزيه بيسيرو، خوض مباراة ودية أمام فريق بهتيم يوم الجمعة المقبل، في إطار الاستعداد لمباراة المصري المقبلة في مسابقة الدوري الممتاز.
وسيخوض الزمالك المباراة الودية في الثالثة والنصف عصر يوم الجمعة المقبل، على ملعب النادي بمقر القلعة البيضاء لتجهيز جميع اللاعبين للمباراة المرتقبة أمام المصري.
ومن المقرر أن تقام المباراة على 4 أشوط كي يحصل جميع اللاعبين على فرصة المشاركة في التجربة الودية.
ويستعد فريق الزمالك لمواجهة المصري، المقرر لها يوم 1 مايو المقبل على ستاد الجيش ببرج العرب، في الجولة الثالثة للمرحلة النهائية لمسابقة الدوري المصري الممتاز.
ويحتل الزمالك المركز الثالث بجدول ترتيب الدوري المصري برصيد 38 نقطة بفارق 6 نقاط عن بيراميدز المتصدر ونقطتين عن الأهلي صاحب المركز الثاني."
