title,body
كرة يد,"كشف نادي الزمالك عن أسباب رحيل ماركو ماركيس مدرب حراس مرمى فريق اليد الذي نشر رسالة غامضة بشأن رحيله عن مصر.
وأوضح الزمالك أن مدرب حراس المرمى قد وقع على مخالصة مالية بعد إنهاء تعاقده بشكل ودي.
وكشف شريف صفوت المنسق العام لشؤون المدربين واللاعبين الأجانب بنادي الزمالك في تصريحاته صحفية: ""ماركو ماركيس فسخ تعاقده بالتراضي"".
وتابع ""النادي جهّز تذاكر الطيران للمدرب ذهابا وإيابا بتاريخ 30 مايو وهو موعد نهاية تعاقده، لكن المدرب فاجأ الجميع بطلب فسخ العقد مبكرا بسبب ظروف أسرية"".
وأضاف ""ماركيس طلب تعديل موعد رحيله عن مصر قبل نهاية عقده، وهو ما كان سيكلف خزينة النادي نحو 70 ألف جنيه، وهو ما رفضه النادي، مطالباً المدرب بتحمل تكلفة التعديل على نفقته الخاصة، الأمر الذي قوبل بالرفض"".
واختتم صفوت تصريحاته ""ماركيس رفض حضور مباراة الزمالك والأهلي في نهائي الكأس رغم تواجده في مصر وتم رفع الأمر إلى مجلس الإدارة، ويتبقى للمدرب شهر ونصف من مستحقاته المالية، سيتم صرفها بنهاية التعاقد وفقا لما ينص عليه العقد بعد تطبيق الغرامة المالية الموقعة عليه بسبب غيابه عن مواجهة نهائي الكأس"".
ولم ينته موسم الزمالك في كرة اليد إذ يتبقى المنافسة على بطولتي السوبر الإفريقي وكأس الكؤوس الإفريقية.
وكشف ماركوس ماركيس مدرب حراس مرمى الزمالك لكرة اليد عبر حسابه الشخصي ""مشجع أهلاوي ساعدني أنا وعائلتي للوصول بسلام إلى كرواتيا"".
وتابع ""أشكره على ذلك وعندما أتأكد أن عائلتي في أمان سأتحدث عن طل شيء بخصوص الزمالك"".
وكان ماركوس قد انضم إلى الجهاز الفني بقيادة الإسباني فرناندو باربيتو المدير الفني للفريق.
ولم يكشف ماركوس تفاصيل رحيله عن مصر إلى كرواتيا موضحا حديثه في وقت لاحق.
وخسر الزمالك هذا الموسم لقب بطولتي الدوري وكأس مصر أمام الأهلي."
سعودي في الجول,"استبعد ستيفانو بيولي مدرب نادي النصر، البرتغالي كريستيانو رونالدو من مواجهة ضمك.
ويحل النصر ضيفا على ضمك مساء الثلاثاء ضمن الجولة 29 من الدوري السعودي.
واستبعد بيولي، رونالدو بحيب صحيفة الرياضية، تجنا للإرهاق إذ يرتبط الفريق بمواجهة قوية بعد 3 أيام ضد يوكوهاما مارينوس الياباني.
ويلعب النصر ضد يوكوهاما مارينوس اليباني يوم السبت المقبل ضمن ربع نهائي دوري أبطال آسيا للنخبة.
فيما سيعتمد بيولي على الجناحين البرازيليين أنجيلو جابرييل وويسلي أمام ضمك في غياب رونالدو.
ويحتل نادي النصر المركز الثالث في جدول ترتيب الدوري السعودي برصيد 57 نقطة.
فيما يتواجد ضمك في المركز الـ11 بجدول الترتيب برصيد 31 نقطة."
الدوري الإنجليزي,"كشف ميكيل أرتيتا مدرب أرسنال مستجدات إصابة لاعبه بوكايو ساكا.
وأصيب ساكا في فوز أرسنال على إبسويتش تاون 4-0 يوم الأحد ضمن الجولة 33 من الدوري الإنجليزي.
وقال أرتيتا في تصريحات للصحفيين: ""علينا أن ننتظر كيف يظهر ساكا في تدريبات الثلاثاء، ولكن لا يوجد شيء خطير"".
وأضاف المدرب الإسباني ""إذا أردنا الاستعانة بساكا أمام كريستال بالاس يوم الأربعاء ستكون هناك فرصة جيدة"".
ويحل كريستال بالاس ضيفا على المدفعجية ضمن الجولة 34 من الدوري الإنجليزي مساء الأربعاء.
وتابع أرتيتا ""الدفع بالبدلاء أمام كريستال بالاس؟ لا يمكنني التفكير بهذه الطريقة، في حالة جاهزية أي لاعب فيجب عليه اللعب"".
وخرج ساكا مصابا في الشوط الثاني متأثرا بتدخل عنيف من ليف ديفيز لاعب إبسويتش الذي تحصل على بطاقة حمراء.
وكان بوكايو قد عاد مؤخرا من إصابة طويلة أبعدته عن الملاعب لأكثر من 3 أشهر.
سيحاول أرسنال الحفاظ على نجمه قبل أسبوع من المواجهة المرتقبة ضد باريس سان جيرمان في ذهاب نصف نهائي دوري أبطال أوروبا."
الكرة المصرية,"تسلم النادي الأهلي مكافأة الحصول على لقب كأس القارات الثلاث بعد فوزه على العين الإماراتي.
وفاز الأهلي على العين 3-0 ليتوج بكأس بطولة أبطال القارات الثلاث آسيا وإفريقيا والمحيط الهادئ.
وحسبما علمFilGoal.comفإن الأهلي تسلم 2.5 مليون دولار مكافآة فوزه بكأس القارات الثلاث على حساب العين الإماراتي.
وينتظر الأهلي نهاية الشهر الجاري وصول قيمة الدفعة الأولى من مستحقاته نظير المشاركة في كأس العالم للأندية التي يصل مجموعها لـ 9.5 مليون دولار.
وسيتسلم الأهلي مبلغ الـ9.5 مليون دولار على دفعات تبدأ من نهاية شهر أبريل الجاري.
ويستعد الأهلي للمشاركة في بطولة كأس العالم للأندية المقرر اقامتها في الولايات المتحدة الأمريكية."
الكرة الأوروبية,"كشفت صحيفة تليجراف عن احتمالية إقالة أنجي بوستيكوجلو المدير الفني لـ توتنام.
وحسب صحيفة تليجراف فإن إقالة بوستيكوجلو واردة في أي حالة عقب انتهاء الموسم حتى إذا توج بالدوري الأوروبي.
ووصل توتنام إلى نصف نهائي الدوري الأوروبي بعد الفوز على أينتراخت فرانكفورت بهدفين مقابل هدف بمجموع المباراتين.
ويقدم مدرب سيلتك السابق موسما سيئا على المستوى المحلي.
ويحتل توتنام المركز الـ16 في جدول ترتيب الدوري الإنجليزي برصيد 37 نقطة."
الدوري الإنجليزي,"يعتقد روبن دياش مدافع مانشستر سيتي أن معركة التأهل لدوري أبطال أوروبا الموسم المقبل ستكون حامية الوطيس.
ويلعب مانشستر سيتي ضد أستون فيلا ضمن الجولة 34 يوم الثلاثاء في مباراة مرتقبة في هذا الصراع.
وقال روبن دياش في تصريحات نشرها موقع ناديه: ""ستكون المنافسة على التأهل لدروي الأبطال حامية، وفي النهاية سيحسمها من يرغب في التأهل أكثر"".
وأضاف ""نعلم أن المنافسة لن تكون سهلة، لكننا نناضل من أجل هذا التأهل، سنبذل قصارى جهدنا لتحقيق ذلك"".
وتابع البرتغالي ""لم يكن هذا أفضل موسم لنا على العديد من المستويات، لكننا نتعلم الدروس ونتطلع إلى المستقبل"".
ويسعى رفاق عمر مرموش لإنهاء الموسم ضمن المراكز الخمسة الأولى، وبالتالي ضمان التأهل لدوري أبطال أوروبا الموسم المقبل.
إذ يلعب مانشستر سيتي ضد كل من: أستون فيلا (داخل) - وولفرهامبتون (داخل) - ساوثامبتون (خارج) - بورنموث (داخل) - فولام (خارج)."
الدوري المصري,"أوضح مصدر مقرب من أحمد سيد ""زيزو"" لاعب الزمالك أنه لا يمانع استكمال الموسم مع الأبيض.
وقال المصدرلـFilGoal.com:""زيزو يتدرب بشكل مستمر في الوقت الحالي منتظرا تحديد موقفه مع الزمالك وهو لا يرفض استكمال الموسم مع الزمالك ولكن بعد الحصول على الضمانات المطلوبة"".
وأضاف ""في حالة عودته للتدريبات فهو جاهز لذلك وللمشاركة بشكل طبيعي في المباريات مع الزمالك، وإذا لم تحل الأزمة فسيكون جاهزا للمشاركة مع الفريق الجديد الذي سينتقل له في الموسم المقبل"".
وأتم تصريحاته ""زيزو لاعب محترف ويعرف كيف يحافظ على جاهزيته ويتدرب مع مدرب خاص بشكل يومي"".
كشف مصدر من نادي الزمالك في وقت سابقلـFilGoal.comعن حقيقة المستحقات المالية المتأخرة للاعب أحمد سيد زيزو، والتي يقدرها اللاعب بقرابة 73 مليون جنيه.
وقال المصدر في تصريحاته لـFilGoal.com: ""قيمة عقد اللاعب تبلغ 55 مليون جنيه بعد خصم الضرائب والرسوم المستحقة للدولة. إجمالي قيمة العقد بما يشمل الضرائب والرسوم تصل إلى 84 مليون جنيه وهو ما تم تدوينه في البند الأول كإجمالي لقيمة العقد عن المواسم الـ 3"".
وأضاف ""اللاعب يتقاضى 15 مليون جنيه في الموسم الأول، و20 في كل من الثاني والثالث، وذلك وفقا للبند الثامن من الشروط الخاصة، والذي يضمن حصول اللاعب على القيمة الصافية بعد خصم الضرائب حفاظا على حقوقه في حال حدوث أي زيادات مستقبلية في نسب الضرائب"".
وأوضح ""اللاعب ووكيله يحاولان إثارة البلبلة، حيث يطالب باعتبار البند الثامن كمكافأة إضافية، متغافلا أن هذا البند مجرد توضيح لقيمة العقد الإجمالية بعد الضرائب، وليس بندا مفصلا للمكافآت"".
وأكمل ""المستحقات المتأخرة للاعب عن الموسم الأخير تبلغ 9 ملايين جنيه قبل استقطاع الضرائب ونسبة المشاركة والعوائد الإعلانية التي يحق للنادي منها نسبة 20%، كما سيتم استقطاع مبالغ مالية نتيجة غياباته المتكررة"".
واختتم ""هذا المبلغ سيظل معلقاً لحين البت فيه من قبل الجهات المختصة، وفقا للوائح والقوانين المنظمة لهذا الشأن"".
وكان FilGoal.com قد كشفحقيقة سقوط مستحقات زيزو المُطالب بها بالتقادم. وكذلكتقدير زيزو للمكافآت الإضافية داخل العقد.
وينتهي تعاقد زيزو مع الزمالك بنهاية الموسم الجاري ويحق له الانتقال لأي فريق بشكل مجاني بداية من الموسم المقبل.
وقال مصدر مقرب من اللاعب لـFilGoal.com: اللاعب أرسل إنذارا للزمالك يطالب فيه بمستحقاته المتأخرة"".
وأضاف ""زيزو يرغب في الحصول على 50 مليون جنيه بنود إضافية في وجود المجلس السابق لم يحصل عليها إضافة إلى مستحقاته المتأخرة التي تتراوح من 16 إلى 20 مليون جنيه، فيما يرى الزمالك أن مستحقات اللاعب المتأخرة تبلغ 9 ملايين جنيه فقط"".
وكان الزمالك قدر أرسل خطابا مسجلا بعلم الوصول إلى أحمد سيد زيزو لاعب الفريق، لإخطاره بالتغيب عن حضور النادي لخوض التدريبات والمباريات منذ يوم 10 أبريل الجاري، وإبلاغه بالعقوبات الموقعة عليه بسبب هذا الغياب.(طالع التفاصيل)
وأعلن الزمالك في بيان في وقت سابق عن وصول العلاقة بينه وبين اللاعب إلى طريق مسدود ونهاية علاقته بالفريق عقب نهاية تعاقده.
كما أعلن مجلس إدارة نادي الزمالك من قبل تحويل زيزو للتحقيق نظرا للتصريحات الإعلامية المسيئة للنادي، وفقا لبيان النادي الأبيض.
قبلها كشف مصدر من النادي الأبيض عن استبعاد زيزو من مباراة ستيلينبوش الجنوب إفريقي في كأس الكونفدرالية، بعد علم مسؤولي النادي بتوقيعه للأهلي منذ 12 مارس."
الدوري المصري,"ينتظر نادي بيراميدز قرار مدربه كرونوسلاف يوريتشيتش بشأن تفعيل بند شراء صديق أوجولا.
ويلعب أوجولا مع بيراميدز على سبيل الإعارة قادما سيراميكا كليوباترا.
وحسبما علمFilGoal.comفإن قرار المدرب الكرواتي سيكون الحاسم بشأن تفعيل بند أحقية شراء أوجولا.
ويبلغ بند أحقية الشراء 2 مليون دولار وينتهي 30 أبريل الجاري، أي إذا لم يفعل بيراميدز البند قبل هذا الموعد فلن يتمكن من ضمه بهذا المبلغ.
ولعب أوجولا مع بيراميدز 20 مباراة خلال الموسم الجاري وتمكن من تسجيل 5 أهداف وصناعة 5 آخرين.
وتوج أوجولا بلقب كأس الرابطة المصرية على حساب فريق طلائع الجيش.
وبدأ أوجولا مسيرته في مصر مع سموحة إذ انضم له قادما من شوتينج ستارز النيجيري دون مقابل في صيف 2021.
وانتقل أوجولا إلى سيراميكا كليوباترا في صيف 2023 قبل أن يرحل إلى بيراميدز."
